{
  "$schema": "../../json-schemas/component.json",
  "name": "prose-pre",
  "type": "component",
  "files": [
    "packages/ui/src/components/prose-pre/prose-pre.vue",
    "packages/ui/src/components/prose-pre/index.ts"
  ],
  "dependencies": {
    "components": [
      "icon",
      "code-icon",
      "button"
    ]
  }
}