{
  "$schema": "../../json-schemas/component.json",
  "name": "code-icon",
  "type": "component",
  "files": [
    "packages/ui/src/components/code-icon/code-icon.vue",
    "packages/ui/src/components/code-icon/index.ts",
    "packages/ui/src/components/code-icon/utils.ts"
  ],
  "dependencies": {
    "components": ["icon"]
  }
}
